<?xml version='1.0' encoding='UTF-8'?>
<!ELEMENT studentList (student)*>
<!ELEMENT student (id|name|age|email|address)*>
<!ELEMENT id (#PCDATA)>
<!ELEMENT name (#PCDATA)>
<!ELEMENT age (#PCDATA)>
<!ELEMENT email (#PCDATA)>
<!ELEMENT address EMPTY>
